Nome,Função,Descrição,Foto,URL
"Profissional 1","Psicólogo Clínico","Lorem ipsum dolor sit amet, consectetur adipiscing elit. Sed do eiusmod tempor incididunt ut labore et dolore magna aliqua.","https://ui-avatars.com/api/?name=Profissional+1&size=200&background=1F4C0E&color=fff&bold=true","https://farukzahra.github.io/sout"
"Profissional 2","Psicóloga Social","Ut enim ad minim veniam, quis nostrud exercitation ullamco laboris nisi ut aliquip ex ea commodo consequat.","https://ui-avatars.com/api/?name=Profissional+2&size=200&background=2D5A1F&color=fff&bold=true","https://farukzahra.github.io/sout"
"Profissional 3","Terapeuta Cultural","Duis aute irure dolor in reprehenderit in voluptate velit esse cillum dolore eu fugiat nulla pariatur.","https://ui-avatars.com/api/?name=Profissional+3&size=200&background=1F4C0E&color=fff&bold=true","https://farukzahra.github.io/sout"
"Profissional 4","Psicóloga de Trauma","Excepteur sint occaecat cupidatat non proident, sunt in culpa qui officia deserunt mollit anim id est laborum.","https://ui-avatars.com/api/?name=Profissional+4&size=200&background=2D5A1F&color=fff&bold=true","https://farukzahra.github.io/sout"
"Profissional 5","Psicólogo Clínico","Sed ut perspiciatis unde omnis iste natus error sit voluptatem accusantium doloremque laudantium.","https://ui-avatars.com/api/?name=Profissional+5&size=200&background=1F4C0E&color=fff&bold=true","https://farukzahra.github.io/sout"
"Profissional 6","Terapeuta de Casais","Totam rem aperiam, eaque ipsa quae ab illo inventore veritatis et quasi architecto beatae vitae dicta sunt.","https://ui-avatars.com/api/?name=Profissional+6&size=200&background=2D5A1F&color=fff&bold=true","https://farukzahra.github.io/sout"
